subreddit,title
The_Donald,The 404 page on Trump’s website leads to this. LOL
The_Donald,The current state of the political side of reddit.
The_Donald,Alleged? We have the Video.
The_Donald,"17 Silver, 18 Gold, 3 Plat. Users are wide awake."
The_Donald,Surprised CBS even showed this!
The_Donald,Reddit Today
Tinder,Just another reminder that people like to be treated like adults and ghosting isn’t cool
Tinder,I don't think she was too pleased with me
Tinder,"After 60+ custom profiles, Tinder banned me. So, here are my 8 favorite."
Tinder,Was gonna wait for her response to post this but I don’t think I’m getting one
Tinder,Straight to the point
Tinder,i’m deleting this app
Tinder,r/humblebrag
Tinder,Boys We Did It
Tinder,My back hurts
Tinder,Her profile said she wouldn't date anyone who would split the bill
Warhammer40k,Guy I played and beat today said: 'Pffft... I am not superstitious. The Dice Gods aren't real and my dice will roll what they roll' ...Me: *secretly upvotes just in case*
Warhammer40k,"Acolytes of Nurgle, circa 2018"
Warhammer40k,HOORAY FOR ZOIDBERG! <GSC Biophagus>
Warhammer40k,"I Found This in the Wilds of Colorado Springs, CO"
Warhammer40k,"A friend insists his AdMech are just intergalactic dishwasher repairmen, so I made him a relic dishwasher objective."
Warhammer40k,"I could never grasp the height of a space marine until I saw this pic, just thought I might share it since other people might be like me also."
Warhammer40k,"Whenever someone tells me that the Emperor hide amongst humanity for most of history, I immediately picture something like this."
Warhammer40k,I’ve heard painting Iconography on knights make the daemons stay in better.
Warhammer40k,The Benevolent One Walks
Warhammer40k,"Really proud with this one, especially the teeth."
WritingPrompts,"[OT] Seven months ago I responded to a prompt about a man who speaks all languages, a McDonald’s, and the horrified cashier who heard him speaking a language that has been dead for a thousand years. Today, Silvertongue is a published novel!"
WritingPrompts,"[WP] Bored with Heaven's docile wildlife, Steve Irwin rounds up a camera crew and leads an expedition to observe and study the native species of Hell."
WritingPrompts,"[WP] You die, but due to an error, instead of going to Hell, you arrive in Heck. This is the story of your travels across the rings of the 7 Forgivable Sins."
WritingPrompts,[PI] Every person can only say 100 words in their lifetime. After which they will die. Write all the dialogue for one person’s life.
WritingPrompts,"[WP] An ancient god ""cursed"" you with immortality, expecting you to watch the Sun swallow the Earth. When that day comes 7.6 billion years into the future, you're living large on the other side of the galaxy."
WritingPrompts,"[WP] You find the ""lizard people rule the world"" conspiracy to be absolutely inane. After all, you're one of them and you ain't running shit."
WritingPrompts,"[WP] A zombie outbreak occurs. It was contained and eradicated in short order with minimal deaths. It's been several months, now the government is trying to coax out the various nerds who bolted to their zombie apocalypse hideouts and haven't come back."
WritingPrompts,"[WP] You live in a martial art anime universe where the characters announce their moves before executing them. As a deaf character, you announce with sign language, which leads to resentment among your defeated opponents of your ""underhanded sneak attacks""."
WritingPrompts,"[WP] Humans can't see spirits, but the same goes vise versa. There's currently chaos in the spirit plane, hulking towers of metal and concrete are appearing at an even faster pace than before, and the spirits must investigate why."
WritingPrompts,"[WP] Medieval times, a woman is accused by villagers of being a witch and she is put in a cage to drown, after 3 minutes she is not dead so they burn her at the stake but she survives that too, villagers now realize they finally found a real witch and don’t know what to do next..."
antiMLM,Found at a coffee shop in India
antiMLM,"“Is it a pyramid scheme?” “Pyramid schemes are illegal, so no...”"
antiMLM,Literally the definition of pyramid scheme.
antiMLM,Please Just Kill Me Already #UnsupportiveHusband
antiMLM,MLM hun tries to give career advice to my friend who is in medical school
antiMLM,"My cousin said she had a ""huge announcement for all her family"" and tagged everyone, me, my mom, my sister, all our aunts and cousins... and went live on Facebook..our whole family thought she was pregnant or that something bad happened..she wanted to announce that she joined and now sells Arbonne.."
antiMLM,Wholesome mlm success story! Poor girl :( At least we saved one!
antiMLM,Someone dropped this off at my restaurant without asking me first... How dare they
antiMLM,"Cram it, Stacy"
antiMLM,"After seeming to message all my friends the same message, I decided to respond"
apexlegends,This guy deserves nothing but respect. A one armed veteran going by the name of “ToeYouUp“ on Twitch getting his first Apex win. Incredible.
apexlegends,"11 months ago, this was leaked in r/titanfall. All he got was pessimistic comments."
apexlegends,Me :(
apexlegends,"Petition to make Pathfinder say, ""My battery is low and it is getting dark"" when low on health"
apexlegends,Welcome to my Lab
apexlegends,In this game I haven’t felt satisfied with any of my wins yet. Does anybody else want this instead?
apexlegends,New Legend Leaked: KARMA!
apexlegends,Let the kill leader have a crown on the skull next to their kills!
apexlegends,"Jokingly asked EA support to play a game of Apex, did not expect this."
apexlegends,Pro Tip: Take control of early game with this method when you're unable to find a gun
assholedesign,Skype never closes
assholedesign,Price was $5.76. Can only pay with quarters.
assholedesign,Perfectly fine lighters with no way to refuel them... planned obsolescence is asshole design and terrible for the environment.
assholedesign,"Facebook splitting the word ""Sponsored"" to bypass adblockers"
assholedesign,"Wondered why my new sheets felt like garbage "
assholedesign,"Skype removes the ""Exit"" option; replaces it with ""Hide"". The Hide button does not hide Skype - it opens it."
assholedesign,The bathroom in my hotel room is the public bathroom for the entire floor...
assholedesign,How to beat the system.
assholedesign,This streaming site suggests turning off Adblock if you want ‘better streaming speed’.
assholedesign,I hate when youtubers do this
aww,Staying at an AirBnB and I woke up to their kitten this morning licking my face. Instant 5 star review
aww,Service doggo walks on glass floor for the first time
aww,Mary was kicked out for loving Jake. Married for 65 years. Cheers for love!
aww,Dog absolutely loving 101 Dalmatians in bar
aww,My aunts cat hates when she leaves so she guards her keys everyday. I told her to film it as proof and this is what she sent me.
aww,Baby duck
aww,"Mister Weez was always my big chonk. After a year of diet and exercise, he’s now my small/medium chonk."
aww,This is Phil.
aww,"""Time for bed kids!"""
aww,My sister rescued this baby girl and gave her new ears
boottoobig,"You’ve lost the will to live, you’re bored out of your sack,"
boottoobig,"Roses are red, I am single"
boottoobig,"Violets are blue, roses are red"
boottoobig,"Roses are red, rocks are gray"
boottoobig,"Roses are red, why do I try,"
boottoobig,"Roses are red, well I'll be damned"
boottoobig,●
boottoobig,"Roses are red, an angry dog snarls,"
boottoobig,"Roses are redd, butts have a cracc"
boottoobig,"Roses are red, this doesn't work as advertised"
cats,I made a custom logo for r/cats because the default is a bit drab
cats,"She came to me with a weakend, soft meow, and a sad look in her eyes as if to say, ""Mama, I'm tired. I'm ready now."" So we laid down in the grass together to soak up the morning sun, one last time. Thank you for 21 years of pure devoted friendship and loyalty. Goodbye my little jungle cat."
cats,Prettiest flower in the garden
cats,"Gaze long enough into the abyss, eventually the abyss gazes back."
cats,My cat got in the way while I was washing my face before bed and I got the best picture of her I’ve ever taken.
cats,How a cat must feel when you post their picture on reddit.
cats,monch?
cats,new and improved snoo cat
cats,Meet the family
cats,There are two types of people.
comedyheaven,the baby was bald
comedyheaven,Nigeria
comedyheaven,Amazing
comedyheaven,Mind blowing
comedyheaven,Arrrgh Spongebob me boy!
comedyheaven,ribs
comedyheaven,S C R U M P T I O U S
comedyheaven,"non "
comedyheaven,Please don't please don't please don't
comedyheaven,It's Quito btw
dank_meme,Facts
dank_meme,wholesome
dank_meme,My son
dank_meme,See you again
dank_meme,Oh
dank_meme,We all can agree with the man.
dank_meme,On god
dank_meme,dank_memeirl
dank_meme,You can't.
dank_meme,Limited edition quarters
dankmemes,Reality is often disappointing
dankmemes,Hockey >> Football
dankmemes,Super annoying smh
dankmemes,The classic formula
dankmemes,Who's next
dankmemes,reality can be whatever I want
dankmemes,This is America!
dankmemes,Just let me drink a free resource god dammit
dankmemes,Good thing I'll go away soon
dankmemes,Whoa
drawing,Every day my very talented Anatomy student draws something for us. I’m going to do a better job keeping record.
drawing,"I just got accepted into an art program, this was one of my portfolio pieces"
drawing,self portrait improvement
drawing,This happy kaiju on a thermal power plant.
drawing,"I like unfinished, broken drawings fading into the page. I hope some of you too."
drawing,This is what I imagined on a rusty pole by the sea.
drawing,It's a caterpillar with a machine gun except I don't know how to draw weapons
drawing,I’m a 22 year old mom and self taught artist who really dreams to make a living off of selling art. Any tips/advice would be very appreciated.
drawing,I like to draw ON pictures (I usually use Instagram so I’m new to reddit)
drawing,"My father is taking up drawing for a hobby. He told me to ""post it on that Reddit website"""
entitledparents,"My Parents Found Out That I Have Money, Wants Me To Give It all To Them"
entitledparents,I am the CEO
entitledparents,EP: Wake your kid so my boy can have her toy
entitledparents,"I do not care if you have CaNCeR, my child DESERVES your seat!"
entitledparents,“WHAT KIND OF SICK PORN IS THAT?!” Entitled ain’t tried to steal my computer and hits my mum
entitledparents,My father sexually abused me as a child. He is also looking forward to helping care for his grandchildren when I have them.
entitledparents,"You're my child, I have the right to poison you!"
entitledparents,"You WILL date my daughter, or I'll get you FIRED!"
entitledparents,Entitled mom tries to deny her dying son his wish and tries to KILL him because the books I got for him are 'satanic'
entitledparents,EM wants me to lie about witnessing sexual harassment to protect her son
exmormon,"Left: me at 20, hoping my mission would cure my gender dysphoria. Right: me at 27, realizing I don't need a church's approval to be my true self!"
exmormon,"Left BYU about 6 years ago to try out this ‘gay’ thing I kept hearing so much about. Now I’m married to this cutie, so I think it worked out well."
exmormon,"Me, the night I was excommunicated, after 43 years of membership. It was as it should be. I was exhausted for three days, afterward. Nine months later, I rest with peace and the humble realization that I am alright. You will be, too!"
exmormon,well damn
exmormon,"Our daughter was at a friend’s house when her friend’s dad (a Bishop) asked what ward we are in. She told them we aren’t Mormons. Her friend asked what religion we are. She thought about it and said. “We’re chill.” And that folks, is our new religion."
exmormon,A Faithful Mormon Friend Said To Me This Morning That Gay People Are Getting Too Many Rights Now Days. This Image Came To Mind And I Told Him I Felt The Same Way About Untaxed Churches. He Blocked Me On Instagram.
exmormon,2 of 4 siblings out! This is our freedom picture with our resignations in hand. Life is so good!
exmormon,The verdict is in. I like margaritas.
exmormon,Forget shoulders...
exmormon,"In the past few weeks, I've had the daughters of three prominent General Authorities (you'd know them all...the Dads I mean) reach out to me as non-believing. We are reaching a tipping point I think."
facepalm,"Media "
facepalm,Logic
facepalm,"It should read ""So I am being fired"". If you don't trust the science behind your chosen career, FIND ANOTHER FUCKING CAREER!"
facepalm,"Ok, now i get it"
facepalm,YES. YES YOU COULD HAVE.
facepalm,"I’m not really sure what to say about this "
facepalm,Are millennials killing not being healthy?
facepalm,"Get out your healing stones and oregano oil, huns"
facepalm,This basically sums up the anti-vaxxer movement in one FB post.
facepalm,Fox News calling Trump fascist
food,[Homemade] Blackberry-Lemon Cheesecake
food,[Homemade] Gyoza
food,[I ate] Garlic Knot Pizza
food,[Homemade] Brisket and Sausage
food,[I ate] a sandwich of Burnt Ends.
food,I get carried away when making charcuterie boards [homemade]
food,[Homemade] Steak frites and a wedge salad.
food,[Homemade] cajun chicken pasta with sun dried tomatoes
food,[Homemade] Succulent Cupcakes with Buttercream frosting
food,[Homemade] doughnut cheeseburger
forhonor,The devs made a free signature for zerker in honor of Stefan Karl Stefansson (may he rest in peace)
forhonor,Hello Darkness My Old Friend
forhonor,When an execution gets you out of harms way
forhonor,Forever Number 1
forhonor,NobuSHETHICC
forhonor,Shield bash meta?
forhonor,Oh fuck oh god
forhonor,Black Prior Conga Line (14 bulwark counters in a row)
forhonor,The mind games are too strong on this one.
forhonor,The Frank Reynolds Meme Trilogy: The Shocking Conclusion!
funny,Reminds me of taking a bath
funny,"Forecast was for freezing rain, but had to go check it out..."
funny,Jamaican Super Lotto winner taking NO CHANCES
funny,"My fiancée thinks I can only embarrass him once this month, but now I have obtained the video. Happy Valentine's Day"
funny,Good Networking Advice
funny,I switched out all my co-worker's cheat sheets while he was out.
funny,Someone called the police on kids sledding down a road so the cops investigated
funny,Mark Wahlberg invited this homeless man to eat for free at his restaurant.. Respect
funny,My dad and I recreated a tender moment 34 years later
funny,Tell me your favorite song
gaming,"I rejected 12 offers from major publishers to make my first game DARQ the way I dreamed it to be. They told me ""you can't make it without us"" and wanted up to 80% cut & IP."
gaming,Anyone else guilty?
gaming,My Grandma has played Wii Fit everyday for over 10 years!
gaming,I found out that my calculus teacher is actually a world record holder in Donkey Kong and has his own documentary
gaming,"Remember when Satoru Iwata cut his salary by 50% for 5 months due to the commercial failure of the Wii U, instead of firing people...these companies should take note."
gaming,At this point just buy a plane..
gaming,"Chess counts, right?"
gaming,"So Activision has secretly added Loot Boxes to BO4. It is now a $60 game, with a $50 season pass, that also has a battle pass you can buy tiers on, direct purchases in game, and now supply drops. Seriously, stop buying Activision’s Games people."
gaming,This was on my local GAME store...
gaming,I'm a truck driver. I 80 is shut down right now and there is a little arcade inside the truck stop. A new competetive scene has emerged.
gatekeeping,Unsure if this belongs here
gatekeeping,Stop appropriating Japanese culture!!
gatekeeping,This one's AMAZING
gatekeeping,Shouldn’t learn Braille if you aren’t blind
gatekeeping,The gate keeper of gate keeping
gatekeeping,I loved Ted first
gatekeeping,White people can't cosplay black characters
gatekeeping,Soo uhh this is kinda awkward
gatekeeping,You can't can't victimise yourself more than this lady here.
gatekeeping,You're not REAL LGBTQ if you are the B enjoying part of your sexuality. (from r/bisexual)
gonewild,"Bitch from Pakistan, what up?   (f) 21"
gonewild,I[f] you ever wondered what your teacher looked like underneath
gonewild,Do 41 year old mil[f]s have a shot in GW?
gonewild,(F) I'm 42. Had 3 kids. And fuck it......I'm gonna compete with all the hot teens and 20-somethings on GW! Bring it on!
gonewild,"[F]irst time actually showing all of my face. Please, be kind."
gonewild,"The riskier the flash, the better  34(f)"
gonewild,"(25f) Bored in the student lounge so let’s post the pic I took before I left for school. All nipples and hips "
gonewild,Mile high club anyone? (Gallery in comments) (F)
gonewild,"To all the girls out there, don’t be afraid to post because of what others might think! All women are beautiful on the inside and out!   [f]"
gonewild,"If my body could talk, she’d said, “fuck me .” [f]"
iamverybadass,stay back 100 meters or you will be shot
iamverybadass,Someone I knew from high school
iamverybadass,Cousin of mine
iamverybadass,I’m cringing a little at this sign my parents just bought for the front door
iamverybadass,"It's not the tweet, it's the super badass caption that Being Libertarian felt the need to add"
iamverybadass,This is the greatest discord badass of All Time
iamverybadass,Comment on a post about an old couple having to slowly put back potatoes one at a time at a grocery store until the price was low enough because they are poor
iamverybadass,Man isn’t even in the Marines yet
iamverybadass,“A living nightmare”
iamverybadass,Badass spotted watching Gordon Ramsey eat wings
ihadastroke,Deadly Water
ihadastroke,Yesno
ihadastroke,I mean idk dude i guess
ihadastroke,Hm?
ihadastroke,I’m bringing chilli
ihadastroke,"Ah yes, firdwrk, my favorite"
ihadastroke,yeet
ihadastroke,Welcom’e to the Tagret
ihadastroke,Girlfriend had a small stroke at 4 am
ihadastroke,I never knew
insanepeoplefacebook,Not all heroes wear capes.
insanepeoplefacebook,"This lady banned all non-vegans from her wedding, including family and bridal party."
insanepeoplefacebook,Shes not happy
insanepeoplefacebook,"That's not how it works, that's not how it works at all"
insanepeoplefacebook,Autistic Bees
insanepeoplefacebook,Reason #142 why most political opinions suck
insanepeoplefacebook,Why mom
insanepeoplefacebook,Racists strike again
insanepeoplefacebook,Posted unironically on Twitter.
insanepeoplefacebook,she was found dead btw
itookapicture,ITAP of a VW Bus reflection
itookapicture,ITAP of a frozen lake.
itookapicture,ITAP of a ballerina in the city
itookapicture,ITAP of a gator in the Everglades
itookapicture,ITAP of my girlfriend in front of a mountain lake
itookapicture,ITAP of a sunset snowstorm in Iceland
itookapicture,ITAP of a motorcyclist
itookapicture,ITAP Of Some Shipping Containers
itookapicture,ITAP of the sunlight shining through a keyhole.
itookapicture,ITAP of a man crossing the street in Tokyo
ksi,I think we need a little rewind
ksi,"THE ""I EAT ASS"" TATTOO!!! - KSI told me to do it"
ksi,i think its a fair deal
ksi,.
ksi,Leaked pictures of KSI sparring
ksi,look at the top of his head
ksi,For real tho...
ksi,Insert title here
ksi,JJ's new hair looks dope
ksi,Upvote if you can picture this happening
legaladvice,"Update, my son took the Boba Fett figure."
legaladvice,My (F26) husband (M28) shared me with his friends while I never consented to it
legaladvice,[CO] My ex lied about vaccinating our immune compromised 8 year old daughter. She now has chicken pox and is in the hospital. I want my ex as far way from my daughter as possible.
legaladvice,"[MN] My niece [14F] had her new Northface jacket stolen from her locker at school, they refuse to do anything, despite video evidence, and instead they insist the thief has “rights”"
legaladvice,"UPDATE Neighbors off leash dog attacks and injures my dog, sister, and myself. Now she's trying to sue me. We're the ones with 29k in medical bills. NC USA"
legaladvice,[FINAL UPDATE] Company cut down trees without permission
legaladvice,"(update) [Nebraska] I just closed on a new house, sellers allege that I owe a portion of their 990$ security system cancellation fee because I did not take over their contract. Threatening small claims court."
legaladvice,[MN] A girl is planning to claim I am the father of her baby when we never had sex
legaladvice,"UPDATE Ex is saying that she lives with me and that I’m abusive, police kicked me out of my own house"
legaladvice,"Exwife is going off the deep end. This is in NJ, USA. Can I do anything here?"
marvelstudios,Chris Evans' fist pump when he sees Black Panther winning Best Production Design is everything. Team Marvel all the way.
marvelstudios,Marvel Studios' Avengers: Endgame - Big Game TV Spot
marvelstudios,I just want to give a shoutout to our very own Don Cheadle for this. You made my younger trans sister cry tears of joy when she saw an Avengers actor publicly supporting her. Thank you sincerely.
marvelstudios,"The actors in Black Panther were amazing, but they didn't do everything. These are the stuntmen responsible for the action scenes between Black Panther and Killmonger: Khalid Ghajji and Daniel Graham"
marvelstudios,"I’ll be honest - I thought the ‘girl power’ crap was overblown. But seeing my daughter look at this and feel like she could be a super hero, too made me well up."
marvelstudios,"Rest In Peace Oreo 2009-2019, the raccoon who inspired Rocket’s look in the MCU"
marvelstudios,I think we all know who should really play J. Jonah Jameson in the MCU
marvelstudios,I'm certain the Avengers trilogy has just been a pissing contest between the villains to see who can drop the heaviest thing
marvelstudios,"Thor: Ragnarok fight scene but ""Holding out for a Hero"" is playing"
marvelstudios,Loki's face though
memes,Our saviour
memes,Wait. That’s illegal
memes,beautiful
memes,Sorry i don't speak oil
memes,"We have to defend Steve Irwin's memory, PETA has gone too far."
memes,Destroyed with logic...
memes,This is wholesome
memes,hol’ up
memes,Sigh! Here we go again . *sorts by controversial*
memes,I was born in the wrong generation >:(
mildlyinfuriating,This is what grinds my gears
mildlyinfuriating,Erasers like these
mildlyinfuriating,UPS doing what they do best.
mildlyinfuriating,"My girlfriend opens new water bottles without finishing the others first. Send help, please."
mildlyinfuriating,She doesn't eat the part of the fry her fingers touched
mildlyinfuriating,Wife doesn’t pay attention to what we already have when buying groceries.
mildlyinfuriating,"I couldn't get my grass to grow, so I replaced it with a rock bed. Six months later and the grass is growing better than ever."
mildlyinfuriating,"Giving the Side Eye "
mildlyinfuriating,75% required to pass this practice exam...
mildlyinfuriating,When you reach the end of your deodorant and the deodorant part falls out
mildlyinteresting,My neighbors are moving their entire house back 200ft.
mildlyinteresting,This door in my hotel bathroom can close off either of 2 doorways.
mildlyinteresting,Two batches of Honey from the same bees. The left jar is from this autumn and the right jar is from this summer.
mildlyinteresting,This restaurant gives you a discount if you have well behaved kids
mildlyinteresting,This Sprite can I found in the ceiling of an old mall.
mildlyinteresting,My plant can't grow close to the Wi-Fi hub.
mildlyinteresting,The way the ice froze on my car this morning
mildlyinteresting,Heavy Rain Turns Stairway Into Waterfall
mildlyinteresting,These knives at my work have been used so much they're almost gone.
mildlyinteresting,Snow covered net roof of the aviary in the zoo. [OC]
nba,Wade kills the Warriors at the buzzer with a three!
nba,"Kareem Abdul-Jabbar is auctioning off his championship rings and MVP trophies for charity: ""When it comes to choosing between storing a championship ring or trophy in a room, or providing kids with an opportunity to change their lives, the choice is pretty simple. Sell it all."""
nba,Curry bounces it high for the Giannis slam | TNT
nba,[The Onion] Knicks confident they have the cap space to ruin 2 or 3 promising careers
nba,"Isaiah Thomas likes tweet: ""Boston dumped Isaiah Thomas after he ruined his hip carrying the Celtics in the Playoffs day's after his sister died. Read that sentence again. Kobe ripped his Achilles off the bone and the Lakers gave him 50 million dollars. Some companies take care of their stars."""
nba,Rondo game winner at the buzzer | TNT
nba,NBA officially proposes lowering draft age to 18
nba,"Lebron: ""They be telling you guys to.. just shutup & be doctor, or just shutup & be laywer, or just shutup & be a teacher, or just shutup & do whatever your occupation is, & I just think that's unfair to all of us, because we are so much more than what our occupations say or what our name tag says"""
nba,Warriors coach Steve Kerr on Super Bowl 53: 'It just gets old watching the same team win'
nba,Marcus Smart takes a page out of Kyrie's book
niceguys,“Fedora with arms”
niceguys,Nice guy demands a gf
niceguys,"A Facebook friend had her bf pass away recently, and she shared this experience from a ""nice guy"""
niceguys,(satire) nice guys NEVER win at bars
niceguys,"UPDATE: ON ECONOMICS GUY (once a nice guy, always a nice guy)"
niceguys,NiceGuys X CreepyAsterisks crossover
niceguys,Nice guys and creepy asterisk crossover courtesy of my boyfriend
niceguys,"You are a sad, strange little man. You have my pity. Farewell."
niceguys,NiceGuys logic
niceguys,an honest observation
nostalgia,Rectangle pizza was the heavy hitter of school lunches in the 80s and early 90s
nostalgia,The green turtle sandbox
nostalgia,A weird thing but does anyone remember when strawberries at the store came in these green plastic baskets?
