subreddit,title
nostalgia,Rappers today look like Doodle Bears
nostalgia,Scooby Doo Gummies Anyone remember the blue ones
nostalgia,Playing Doom on your home pc
nostalgia,Anyone remember making these shoebox dioramas for school?
nostalgia,When the back of a cereal box was your morning paper.
nostalgia,I found my old Sidekick. Feels just as good as it did back then
nostalgia,Trix Yogurt by Yoplait was pretty bomb
oddlysatisfying,Wallace sculpted from a 40lb block of sharp cheddar
oddlysatisfying,Perfect chocolate devouring courtesy of artist Kevin Parry
oddlysatisfying,This Kinder Surprise Box
oddlysatisfying,Fruits and Vegetables
oddlysatisfying,I’m an art teacher and I moved to a new school this past summer. The previous teacher did not share my love of organization. Behold the before and after of my paper closet!
oddlysatisfying,Baking
oddlysatisfying,Inflatable monsters outside of car dealerships
oddlysatisfying,[OC] The way this sand falls on this sand dune in the Sahara
oddlysatisfying,This clean ice
oddlysatisfying,Wax Seal
okbuddyretard,"about time that robert man was banned! Phew, he was such a cringe! xD"
okbuddyretard,Mom please I need it
okbuddyretard,OUR DAD IS GONE
okbuddyretard,Now this is epic
okbuddyretard,oh no! mrs. fritz !!
okbuddyretard,Bock and call
okbuddyretard,school is fuck!
okbuddyretard,Cringe normie didn't get the joke lmao
okbuddyretard,this belt kinda slick tho
okbuddyretard,stupid fucking mods i wil leat you itll be so epic
pcmasterrace,Can we take a moment to appreciate all that Linus Sebastian has done for us?
pcmasterrace,Still the best platform!
pcmasterrace,The good ol' days.
pcmasterrace,Why
pcmasterrace,Be brave little one.
pcmasterrace,Facts or nah?
pcmasterrace,This subreddit in a picture
pcmasterrace,Made a thing...
pcmasterrace,Superior
pcmasterrace,Seems good to me
pics,"Given that reddit just took a $150 million investment from a Chinese censorship powerhouse, I thought it would be nice to post this picture of ""Tank Man"" at Tienanmen Square before our new glorious overlords decide we cannot post it anymore."
pics,"Today, NASA will officially have to say goodbye to the little rover that could. The Mars Opportunity Rover was meant to last just 90 days and instead marched on for 14 years. It finally lost contact with earth after it was hit by a fierce dust storm."
pics,This person sold their VHS player on eBay and got a surprise letter in the mailbox.
pics,The real picture of Tienanmen Square people should be posting
pics,Went to open my fridge. Definitely thought my hand was connected properly.
pics,His adventure is just beginning
pics,"If Batman is so rich, then why does he have to keep renting out his garage for music videos?"
pics,Original look back meme
pics,Pulled over on the highway to get this photo. I’m glad I stopped.
pics,Ross from Friends with Nicolas Cages face on him just makes him look more like Ross
pokemon,Pokemon Sword and Shield is Generation 8!
pokemon,Kowalski always delivers
pokemon,A star is born
pokemon,Well this is awkward
pokemon,Millenials to Gen Z
pokemon,Shiny Gengar
pokemon,this is getting out of hand
pokemon,The real reason to use Machamp
pokemon,I love all of the eeveelutions
pokemon,hmmm
politics,"Ohio city to stop observing Columbus Day, make Election Day holiday instead"
politics,Alexandria Ocasio-Cortez's 'Corruption Game' Speech Is Now the Most Viewed Twitter Video of Any Politician
politics,Megathread: Bernie Sanders announces 2020 presidential run
politics,Alexandria Ocasio-Cortez Exposes The Dark Side Of Politics In 5 Incredible Minutes
politics,Fox News Hosts Are Horrified to Learn Their Own Polls Show People Want to Tax the Rich
politics,16 states sue President Trump over border wall
politics,Matt Gaetz Under Investigation By Florida State Bar Over Michael Cohen Threat
politics,GOP Finally Has Documented Case of Election Fraud — Committed by Republicans
politics,Bernie Sanders Politely Asks Supporters Not to Harass His Opponents
politics,Alexandria Ocasio-Cortez’s “lightning round” on money in politics goes viral
rarepuppers,When all the puppers wake up from their nap at once...
rarepuppers,Housesitting means I have a video game buddy this weekend.
rarepuppers,Have you even seen such an angel?
rarepuppers,Where can I find this goodboi?
rarepuppers,The noble Samoyeds
rarepuppers,"The cuteness, it hurts."
rarepuppers,Doggo who gives the highest of fives.
rarepuppers,Pupper too light to make snowprints
rarepuppers,Cute fluffo
rarepuppers,A VERY VERY HARD-WORKING BOY
reddeadredemption,When you've killed 2 legendary animals but only have 1 horse
reddeadredemption,"As a Native American, Rains Fall seemed odd to me and I couldn't place why. I figured it out, and it's because he has eyebrows. In the 19th century, my people, the Lakota, of whom Rains Fall belongs, did not have eyebrows, as facial hair was seen as ugly and unmasculine, and was plucked regularly."
reddeadredemption,LMAO....worst death ever in RDR 2 ?
reddeadredemption,This fucking update made Online even worse
reddeadredemption,The mad man actually did it
reddeadredemption,Found that one saloon from St. Denis irl in New Orleans
reddeadredemption,So yeah....... day two of broken online
reddeadredemption,Found a way to kill Micah. Enjoy.
reddeadredemption,Working on my Arthur drawing. Hope y’all enjoy
reddeadredemption,Thanks Rains Fall
sbubby,"Dear Americans,"
sbubby,Why did I spend a whole week on this?
sbubby,just stop
sbubby,Only epic gamers will get this 300 iq maymay
sbubby,A beautiful comedy
sbubby,Oh god oh frick
sbubby,What store are you at?
sbubby,Complete garbage (oc made by me)
sbubby,to all those rich redditors out theres
sbubby,super bowl
softwaregore,Chrome PDF viewer crashed while printing a document
softwaregore,Wing flex on a Boeing 787 in a flight simulator
softwaregore,The OG software gore.
softwaregore,My TV frozzzzzeeee.
softwaregore,I’ll get him to 0 followers
softwaregore,Who lives in a nightmarish void under the sea?
softwaregore,A Very Important Day in Mexican History
softwaregore,Everything is good
softwaregore,Flight simulators should stick to flying objects apparently
softwaregore,"Yes google, seems legit"
succulents,Variegated jellybean update: 6 months old and looking tasty
succulents,Don't talk to me or my son ever again.
succulents,Aeonium greenovia
succulents,"Found a leaf in a dust pile 3 years ago this month. Stuck it in dirt, and it grew! Here's my Snake plant named Floor Leaf."
succulents,I made a succulent bouquet for my wedding last week
succulents,Look at this beautiful Sempervivum Calcareum I just got at Home Depot today. You like?
succulents,Bought this candle for the planter it will be later!
succulents,These flowers only last one day.
succulents,"I fricken love succulents, they create their own rules on propagation."
succulents,"I think he’s much happier now that he has a home "
teenagers,Its been 1 year already since Peter Wang died while attempting to save his fellow classmates
teenagers,ATTENTION ALL TEENAGERS: This sub is an early breeding ground for future INCELS and we should work to prevent it.
teenagers,It was so disappointing..
teenagers,"Keeping the Wii Shop Channel open for as long as possible: Day... End. A power outage has struck, ending my journey. Thank you to all of my followers and to everyone who helped along this journey. Thank you Nintendo for 12 years of joy. May the shop stay with us forever <3"
teenagers,"Keeping the wii shop channel open for as long as possible: Day 8. Its been more than a week, the wii has been staying cool and quiet. Progress is running smoothly. I am one of the last people on the servers by now, wish me luck everybody."
teenagers,How do I full screen it
teenagers,They’re very special indeed
teenagers,His reaction to my post going viral
teenagers,My friend abruptly got off xbox so I asked him why
teenagers,"You guys THOUGHT the Wii Shop Channel was officially dead, but I and potentially many others have yet to experience a power outage. May the battle continue a little longer."
thatHappened,Ultimate Survival Mode
thatHappened,What a weird fucking thing to say
thatHappened,He literally bowed.
thatHappened,Delusional tall man thinks women openly drool over his phenomenal height
thatHappened,"Yes of course,it happened...."
thatHappened,I’m not like most white guys
thatHappened,"Man, she sure showed him!"
thatHappened,Molester Moon
thatHappened,And then she revealed herself to be Howard Schultz
thatHappened,Uhm does that count as a pedophile
todayilearned,"TIL in the 1880s, the Harvard Observatory director was frustrated with his staff, and would say ""My Scottish maid could do better!"" So, he hired his Scottish maid. Williamina Fleming ran a team for decades, classified tens of thousands of stars, & discovered white dwarfs and the Horsehead Nebula."
todayilearned,"TIL Mike Tyson loved keeping pigeons as a kid and the first fight he ever got into was when a thug ripped the head off one of his birds. He said, “The pigeon was the first thing I ever loved in my life. I don’t know why, I feel ridiculous trying to explain it. Pigeons are just so much like people.”"
todayilearned,"TIL a Harvard study found that hiring one highly productive ‘toxic worker’ does more damage to a company’s bottom line than employing several less productive, but more cooperative, workers."
todayilearned,"TIL that a Polish environmental charity put a SIM card in a GPS tracker to follow the migratory pattern of a white stork. They lost track of the stork and later received a phone bill for $2,700; someone in Sudan had taken the SIM from the tracker and made over 20 hours of calls."
todayilearned,TIL that the Chernobyl disaster could have been 10x worse and could have affected most of Europe if three volunteer divers didn't drain a pool to prevent a second explosion.
todayilearned,"TIL that when Michael Jackson granted Weird Al Yankovic permission to do ""Fat"" (a parody of ""Bad""), Jackson allowed him to use the same set built for his own ""Badder"" video from the Moonwalker film. Yankovic said that Jackson's support helped to gain approval from other artists he wanted to parody."
todayilearned,TIL that the NFL made a commitee to falsify information to cover up brain damage in their players
todayilearned,"TIL that an Anti seat-belt advocate, Derek Kieper, once wrote that “Uncle Sam is not here to regulate every facet of life no matter the consequences.” He later died after being thrown from his vehicle while driving without a seat-belt."
todayilearned,"TIL That most female cheetahs go their entire lives without raising a single cub to maturity. The species is dependent on ""supermoms"" that are particularly adept at raising cubs. One such supermom, Eleanor, has mothered at least 10% of all adult cheetahs in the southern Serengeti."
todayilearned,"TIL High priced college textbooks bundled with ""access codes"" that expire at the end of the semester largely force students to buy books at retail prices at campus bookstores and render the texts worthless in the resale market. Nearly four in 10 college courses bundle their texts with access codes."
traaaaaaannnnnnnnnns,Not all heroes have capes
traaaaaaannnnnnnnnns,The struggle
traaaaaaannnnnnnnnns,Downvoting casual transphobia on default subs
traaaaaaannnnnnnnnns,Titty skittles is good and all but...
traaaaaaannnnnnnnnns,"Just came out to my grandma, I love her so much aaaaaaa"
traaaaaaannnnnnnnnns,And that's the tea
traaaaaaannnnnnnnnns,Emotions_irl
traaaaaaannnnnnnnnns,
traaaaaaannnnnnnnnns,"I don't care whether this is true or not, it's just badass."
traaaaaaannnnnnnnnns,for anyone who needs it as much as i did
trashy,What a racist lady has to say after letting her cross the street first
trashy,Last night around 11:30 an amber alert was sent out to everyone's phone asking for people to keep an eye out for an 11 year old girl that was abducted by her father. The police had to tweet this out shortly after. Unbelievable.
trashy,"She is an adult and that girl is really small.She literally snatched the ball from the little girl, without even thinking about how old and trashy she would be."
trashy,"Every employee at this Sonic location quit because the new owners lowered their pay to “$4 per hour, plus tips”. But fast food workers never get tipped, so how is this even legal?? Shame on the new owners"
trashy,This guy killed my bud and posted this before he was arrested today.
trashy,"Our dorm building only has one facilities person to clean, she works so hard yet the people on my floor are still disgusting. I can't blame her for leaving this note."
trashy,Happy Trashy Valentines Day!
trashy,Found this in my apartment's stairwell. Give them their granny back!
trashy,How Walmart packages their betta fish
trashy,All mother aren’t great
trees,"Dem senator introduces S. 420 bill that would legalize marijuana. Welp, there it is, the bill that would legalize weed federally. Now make sure everyone knows about it. Friends, family, city council, state reps, state sens, congressman, senators, govs. Let EVERYONE in power know you support S. 420!"
trees,"Two years ago I posted on r/trees and she commented on that post. Now I'm 4,684 miles from home at a bar with her"
trees,"I got so high at the cinema, I couldn't move and sat through 5 movies as people came and went. But then I realized I'd just sat through the trailers."
trees,"Smoking one last time before I say good bye. Realized I had nothing left here, and have decided to just move west to a legal state. No friends, no family, here I go!"
trees,"CBS wouldn’t agree to playing a medical marijuana ad, but they agreed to a Scientology one. Something is wrong here."
trees,"When your grandma finds your grinder "
trees,56 joints for $55 at my local dispensary. Adios muchachos
trees,1986 Coke can found in a ceiling.
trees,Especially true for Backwoods.
trees,Enter
unpopularopinion,"We spend TOO much time discussing homosexuality when only ~4% of the population is gay, but meanwhile 80% of the population of the planet lives in poverty."
unpopularopinion,Just because you can sing a popular song at half speed in a breathy voice whilst slowly strumming a guitar doesn't mean you're talented.
unpopularopinion,"If someone tells you ""I'll pray for you"" with sincerity, and you respond with a rude comment about religion, you're an asshole."
unpopularopinion,Americans are far from the monsters they are made out to be.
unpopularopinion,Emotes such as “:)” are much better than emojis
unpopularopinion,If alcohol was invented today it would be prohibited
unpopularopinion,"I don't care about school shootings, and neither should you."
unpopularopinion,Burgers that are so big you can't even bite them are stupid
unpopularopinion,"90% of beauty standards women feel are enforced by other women, not men"
unpopularopinion,People who drive 15-20 mph under speed limit and brake check anyone they think is too close are more dangerous than speeders and tailgaters and should be punished more.
videos,"Youtube is Facilitating the Sexual Exploitation of Children, and it's Being Monetized (2019)"
videos,Rapper Sheck Wes doesn't pay for his music video so the production team uploads this instead.
videos,"YouTube channel that uploads piano tutorials has been demonetized for ""repetitious content"""
videos,Tiananmen Square Massacre
videos,Flat Earthers experimentally disproving themselves
videos,"Live streamer unknowingly admits to running a ponzi scheme, conning millions of dollars from investors"
videos,This skit from The Onion News has some of the best acting I’ve ever seen
videos,"A Dad mic'd up his 4 year old at Hockey practise, its as cute as it sounds."
videos,"Former Facebook exec: ""I think we have created tools that are ripping apart the social fabric of how society works. The short-term, dopamine-driven feedback loops we’ve created are destroying how society works. No civil discourse, no cooperation; misinformation, mistruth. You are being programmed"""
videos,Every candidate for the new Batman should be required to audition with this scene
whatisthisthing,"Found in my dads room, really hoping its not a sex thing"
whatisthisthing,My brother found this (missile?) in the woods in Tennessee
whatisthisthing,"This was found by a cleaner hidden under my dresser in my bedroom (she told me very discreetly about this which has me concerned), I’ve tried to google it to no avail. Please help, link in comments with all angles."
whatisthisthing,My father just passed and these are his dress blues from the Air Force can anyone tell me what all of this means? I am at a loss and want to know.
whatisthisthing,Growing in my sink drain. Collapses when I run the water. This is a picture when it is dry. I know it goes all the way down because my sink is not draining as well as it used to. Would love to be able to kill it.
whatisthisthing,"Mom found this bullet on the beach about a year ago, how old is it and from what type of gun?"
whatisthisthing,My license plate has been cloned and I’m receiving fines for their offences. Anybody know what car would have these type of lights?
whatisthisthing,What type of vehicle hit my family member and drove off?
whatisthisthing,Dug this up 3 ft deep in the pavement located in the outskirts of London. Weighs about 6kg. Looks like an unexploded artillery shell. Currently on the phone to police advisory line.
whatisthisthing,Jelly fish found on the beach
wholesomememes,Man invites entire world to celebrate holiday
wholesomememes,wholesome youtuber
wholesomememes,Here’s hoping he yeets for many years to come.
wholesomememes,the most wholesome parents
wholesomememes,That's how every person with Authority in a school should be.
wholesomememes,Tomorrow’s another day
wholesomememes,Happy 62nd Birthday LeVar Burton!
wholesomememes,"Happy crying, so proud"
wholesomememes,You are loved
wholesomememes,"Great sendoff for Duke, thank you for your service"
woooosh,You’re*
woooosh,the flat earth on this tshirt is definitely not a joke
woooosh,this is quite offensive
woooosh,"curse you, perry the platypus"
woooosh,It's almost like it was designed to not make sense
woooosh,This is two stupid
woooosh,Some people are so irrogate
woooosh,5 foot 12
woooosh,Yep... YEP
woooosh,I threw that before I came in the room!
worldnews,"Canadian school board issues 6000 suspension notices over lack of vaccination records, forcing students to vaccinate"
worldnews,Facebook is thinking about removing anti-vaccination content as backlash intensifies over the spread of misinformation on the social network
worldnews,"""Mexican scientist cures the Human Papilloma Virus"" - Eva Ramón Gallegos, a researcher at Mexico National Polytechnic Institute was able to completely eradicate the Human Papilloma Virus (HPV) in 29 patients using non-invasive photodynamic therapy: a method using oxygen and light frequencies."
worldnews,China suddenly takes BBC news off air after Muslim detention camps mentioned
worldnews,Mars Rover Opportunity Is Dead After Record-Breaking 15 Years on Red Planet
worldnews,WHO Recommends Rescheduling Cannabis in International Law for First Time in History
worldnews,Historian who confronted Davos billionaires leaks Tucker Carlson rant
worldnews,"Cardinal George Pell, once the third most powerful man in the Vatican and Australia’s most senior Catholic, has been found guilty of child sexual abuse after a trial in Melbourne."
worldnews,Multiple Whistleblowers Raise Grave Concerns with White House Efforts to Transfer Sensitive U.S. Nuclear Technology to Saudi Arabia
worldnews,Australian Teens Ignore Anti-Vaxxer Parents by Getting Secret Vaccinations
