subreddit,title
2007scape,Remove the privacy panels on the poll booth models because we don’t use em anyway
2007scape,Jim Halpert Shows His Girlfriend Swamplethics
2007scape,[Suggestion] Qol Suggestion: Skill guide icons
2007scape,Building an Arsenal: The Maple Log (#13) (Swampletics)
2007scape,My Hunter level is 2. (#12) (Swampletics)
2007scape,This guy in my class
2007scape,Mining in F2P
2007scape,[SUGGESTION] Revamp sand mechanics to be more like this:
2007scape,Make the agility guy talk to us like we ain't shit for motivation
2007scape,The Drop Table Problem - (Analysing gameplay design & reward balancing in OSRS)
AmItheAsshole,AITA For purposely stopping my classmate from winning an award and subsequently making her cry?
AmItheAsshole,AITA: Newlywed husband (32M) wanted to wait til marriage for sex and just surprised me (27F) with micropenis on the honeymoon.
AmItheAsshole,Aita for giving a woman a taste of her own behavior
AmItheAsshole,AITA for being mad that my birthday gift was sex?
AmItheAsshole,AITA for humiliating a 'fat acceptance' girl?
AmItheAsshole,AITA because my husband saw my post and says he wants to leave me and sue me? Says he wants an annulment and is considering suing me for defamation of character.
AmItheAsshole,AITA for not letting my kids go on vacation with my ex because it's my time with them.
AmItheAsshole,AITA for telling my girlfriend her hate for babies is pathetic and doesn't make her cool or edgy?
AmItheAsshole,WIBTA If I don't share my rather large (to me at least) inheritance with my aunt and 3 cousins?
AmItheAsshole,AITA for grabbing a stranger's boob?
Animemes,Hello everyone
Animemes,Woah that’s like 1 more dimension than what I’m comfortable with
Animemes,End me please
Animemes,How to make an Animeme
Animemes,And aren't we all just trying to get isekai-ed?
Animemes,Check-FUCKING-Mate
Animemes,Nekopara why do you do this
Animemes,Thank you Holo
Animemes,shonen protagonists
Animemes,"Naofumi-sama, It's fine now..."
AnthemTheGame,"Text chat? I'm mute, I physically cannot speak."
AnthemTheGame,"Remember, there are real people who poured their heart and soul into this game."
AnthemTheGame,Anthem Loot Update
AnthemTheGame,Anthem reviews are seemingly harsher than other games because it failed at a time when gamers are just fed up with being overpromised and under delivered.
AnthemTheGame,"BioWare, replace the current loading screens with pages from the Codex"
AnthemTheGame,Reward structure issues and ideas
AnthemTheGame,The man has spoken
AnthemTheGame,"A lesson I think Anthem/Bioware could learn from Diablo III when it comes to loot: ""Be Generous"""
AnthemTheGame,Nothing will kill this game faster than scarce loot drops
AnthemTheGame,"Usually using a flamethrower while flying will make you hover. If you start the lightning coil first, you become a dragon wreaking havoc on all your prey below."
Art,"Disco Dingo, Digital, 1200 x 675 px"
Art,"""Valley of the Dark"" by do-ra, digital, 2018"
Art,"Untitled, mixed media but mostly water color, 10x13ish"
Art,"Shocked owls, Digital, A4"
Art,"Candles, digital, 680x850 px"
Art,"Drink & Dream, Digital, 2500 X 1816"
Art,"Girl with Heterochromia, Irakli Nadar, Digital, 2019"
Art,"""Shrööm"", Digital, 960 x 1200px"
Art,"a miner frustration, Alfredo Rodriguez, Oil on Linen, 1954"
Art,"Over Indulgence, Photography, 2000x1333"
AskOuija,Put the money in the fucking bag! This is a ______!
AskOuija,I can’t send my son to school because he’s allergic to _______.
AskOuija,______ this post to instantly die.
AskOuija,"As my wife gave birth, the midwife pulled it out and shouted, ""It's a ____!"""
AskOuija,"My kids aren’t vaccinated, they’re ______ated."
AskOuija,If you vaccinate your kids you basically _______ them.
AskOuija,"I like movies containing drugs, sex and v_______."
AskOuija,"See you later, alligator. After while, ________."
AskOuija,"If I had a nickel for every time I’ve had sex, I would have a __________"
AskOuija,"My dad died doing what he loved most, ________."
AskReddit,You gain control of JK Rowling's twitter account for a day. What unnecessary piece of information do you add to Harry Potter lore?
AskReddit,"You are offered $1,000,000 USD if you can hide a pair of car keys from the entirety of the FBI force for 7 days. Where do you hide the keys?"
AskReddit,Which conspiracy theory is so believable that it might be true?
AskReddit,We are now less than 45 days from April Fool's Day. What 'long con' pranks should be started around now?
AskReddit,"Were you ever that 1 in 1,000,000? If so, what's your story?"
AskReddit,What free software is so good you can't believe it's free?
AskReddit,"Multilinguals, what's your ""they didn't realise I could understand their language"" story?"
AskReddit,What is something super important that is on the verge of happening?
AskReddit,People who read the terms and conditions of any website or game. What's something you think other people should know about them?
AskReddit,What is the craziest encounter of 'rich kid syndrome' that you have experienced?
BikiniBottomTwitter,Wait... is that it?
BikiniBottomTwitter,"It's no Superbowl, but they played this at the Dallas Stars hockey game"
BikiniBottomTwitter,r/BikiniBottomTwitter when Sweet Victory wasn’t performed
BikiniBottomTwitter,Gang gang gang
BikiniBottomTwitter,The NFL’s halftime show vs. The NHL’s
BikiniBottomTwitter,Let's make Squidward proud
BikiniBottomTwitter,Found this in the school computer lab
BikiniBottomTwitter,We can all agree now...
BikiniBottomTwitter,Maybe even more than one
BikiniBottomTwitter,Angry mob time
Blackops4,A paintball park where I live recreated “Firing Range”
Blackops4,Black Ops 4 Map Design Blueprints Leaked
Blackops4,Treyarch to Black Ops Pass owners after releasing DLC 1
Blackops4,Me trying to use spitfire
Blackops4,This tablet is more advanced then i expected
Blackops4,Vonderhaar gets real with the community on Twitter
Blackops4,New content update .
Blackops4,Treyarch take notes from your competition. This is what they did with the dpad instead of emotes...
Blackops4,This relatable to anyone else?
Blackops4,I think we can all agree that Activision is ruining Treyarch
Bossfight,"Pete, the unwashed"
Bossfight,"Chad Champion, Collector of Bonuses"
Bossfight,The four wholesome men of the apocalypse
Bossfight,Bruno the upper body bork
Bossfight,"Drackob, the installation wizard"
Bossfight,"Mallet-boy, the mysterious one"
Bossfight,The Creaming Terror
Bossfight,"Shaggy, savior of the galaxy"
Bossfight,The Oraclens - they know all your secrets
Bossfight,The Uwu Man.
Brawlstars,[SKIN IDEA] Nightwitch Mortis Remodeling Suggest
Brawlstars,[SKIN IDEA] Musketeer Penny
Brawlstars,[SKIN IDEA] Kimono Leon
Brawlstars,[SKIN IDEA] Clown Mortis
Brawlstars,[Skin Idea] Tiger Nita !!!
Brawlstars,Shelly bullies Gene
Brawlstars,[Idea] Bo Remodel by u/phlorpe
Brawlstars,[SKIN IDEA] Ninja cat Tara
Brawlstars,[Art] The real Star Player!
Brawlstars,Gotcha
ChapoTrapHouse,I made this; I figured ya’ll would appreciate it.
ChapoTrapHouse,Democratic Party slogan
ChapoTrapHouse,It's time for y'all to admit there's a really good chance Kamala Harris would beat Trump
ChapoTrapHouse,HE’S RUNNING
ChapoTrapHouse,Nice
ChapoTrapHouse,Accurate portrayal of the typical CTH listener.
ChapoTrapHouse,pneumonia take my energy
ChapoTrapHouse,heroic
ChapoTrapHouse,She is Braver than the Troops
ChapoTrapHouse,He has spoken
ComedyCemetery,THIS IS SAVAGE
ComedyCemetery,Back to the year 2009.
ComedyCemetery,SmartphOWNED.com
ComedyCemetery,An ad for a mobile game.
ComedyCemetery,My uncle shared this image
ComedyCemetery,What the hell lol
ComedyCemetery,Haha guys this is too funny
ComedyCemetery,You're welcome vegans
ComedyCemetery,Gotta love Facebook
ComedyCemetery,Dumb woman try to stop gamer
CrappyDesign,"Ah yes, the 18-24 year old baby"
CrappyDesign,Balenciagas new $5000 dress
CrappyDesign,Maintenance put new locks and handles on the gates for security
CrappyDesign,"Sink attached to the toilet, forming a perfect slide"
CrappyDesign,Hotel’s Mirror
CrappyDesign,The woman isn't driving in this article about women being better drivers.
CrappyDesign,These 2 useless seats in the movie theater.
CrappyDesign,Please kill me.
CrappyDesign,It’s cool just do it at night mate
CrappyDesign,The view from my hotel room
DeepFriedMemes,"Outstanding Move "
DeepFriedMemes,Ain’t that some shit...
DeepFriedMemes,It’s all due to too many videogames!
DeepFriedMemes,This is yeety
DeepFriedMemes,Hi can someone send help
DeepFriedMemes,h
DeepFriedMemes,sit down peasants
DeepFriedMemes,How many times do I have to teach you this lesson Chris?
DeepFriedMemes,"I wish "
DeepFriedMemes,peep my new wallpaper
DnD,I just revealed a dumb joke to my players that was a year in the making and it was SO WORTH IT.
DnD,"[OC] Grabbing snacks for my players today. The cashier: ""Getting ready for the big game?"" Me: ""How did... ah yes... Football... go Pats :|"""
DnD,[OC] Awesome dice tower a party member made!
DnD,[Art] Is it a nice view?
DnD,[OC] [Art] When the cleric rolls medicine instead of using a spell due to ideological differences
DnD,[ART] Magic Arrows
DnD,"[OC] I´m the guy that got the replacement sent from Wizards, which didn´t turn out to be better. Here is my new package."
DnD,My character died this weekend. I decided to write down his last moments.
DnD,[Art] Wizards of the Coast announced a new written campaign: Ghosts of Saltmarsh!
DnD,THIS is how you get a customer for life! I only ordered one metal die. The set and hand written note came as a big bonus. [OC]
DunderMifflin,You have a lot to learn
DunderMifflin,The Scranton Strangler was at Dunder Mifflin!
DunderMifflin,Happy 75th Creed!
DunderMifflin,Something to brighten your Friday.
DunderMifflin,"Bob Vance bought me this meme, it's from metropolitan Orlando"
DunderMifflin,Everyone has their opinion on what their favorite Jim prank is. This is mine
DunderMifflin,Darryl’s underrated pranking ability
DunderMifflin,I struggle not to give this answer every time I'm asked
DunderMifflin,the genie we deserved
DunderMifflin,Dwight thinking ahead
FIFA,Next promo
FIFA,Bayern Admin with the banter
FIFA,Best glitch that I have encountered
FIFA,Too bad we're undoubtedly the most spineless and guillible gaming community there is
FIFA,when ur mate Gabe does a stepover
FIFA,The entire collection of FIFA 19 content mistakes
FIFA,The Endless FIFA Cycle
FIFA,Who else doesn’t understand why EA took this out of the practice arena back in FIFA 15?
FIFA,Faxx
FIFA,A life lesson FIFA taught me
FellowKids,Think this counts
FellowKids,Today's Foxtrot.
FellowKids,"Don't make me get my leash, PETA."
FellowKids,"This was a Super bad idea, Man"
FellowKids,oof
FellowKids,wtf
FellowKids,I was organizing my hard drive and found this gem
FellowKids,In my English class
FellowKids,o god why
FellowKids,I cant think of a good title...
FireEmblemHeroes,Boons 'n Banes
FireEmblemHeroes,I draw Lucina Masked Marth [fanart]
FireEmblemHeroes,"It is time, my friends"
FireEmblemHeroes,Lunar New Year Micaiah
FireEmblemHeroes,soft casual lucina
FireEmblemHeroes,Abyssal F!Robin using only level 1 units.
FireEmblemHeroes,[fanArt] Ophelia - Daughter of Owain Dark - The chosen heroine
FireEmblemHeroes,If there exists a CYL Reinhardt in Thrud's armor……
FireEmblemHeroes,Children Stroll
FireEmblemHeroes,Comic on Gold Orbs
FortNiteBR,This guy deserves the world
FortNiteBR,Player hiding in a building? Knock it down he said.
FortNiteBR,PC Players: AIM assist and ADS spam is WAY too op. Console players have too much of an advant...
FortNiteBR,I see your backflip while doing a backflip and hitting a backflipper and raise you a backflip IRL while doing a backflip while doing a backflip and hitting a snipe.
FortNiteBR,"This was truly the most amazing Online event I have experienced, I was blown away"
FortNiteBR,"i don’t care what anyone says, this is top 5 best plays in fortnite history"
FortNiteBR,Marshmello's concert for anyone that missed it!
FortNiteBR,Players hiding in a building? Knock it down.
FortNiteBR,"Shoutout to Tfue for being a great example as to how to be respectful toward the community especially other platforms, and understanding the struggles"
FortNiteBR,I see your backflip while doing a backflip and hitting a shot and I raise the stakes with a backflip while doing a backflip and hitting a backfliper
FreeKarma4U,"Bless up with some upvotes, I’m trying to hit 500"
FreeKarma4U,How many?
FreeKarma4U,Help me with some upvotes please
FreeKarma4U,Hey guys i could use some karma. I give back like always
FreeKarma4U,Help me with some upvotes please
FreeKarma4U,"Guys, can you help me to get to 1500 karma points please? I will upvote all the comments too"
FreeKarma4U,(K4K) New Karma Post! Lets get it on :D
FreeKarma4U,(K4K) COMMENT SPAM THIS MF'ER :)
FreeKarma4U,Hey guys! I’m trying to get to 25k. I’ll upvote anyone who comments!
FreeKarma4U,Need 10 karma! Returning ASAP
Gamingcirclejerk,STOP THIS IS POLITICAL!! anyway i'm gonna go destroy israel in CS:GO
Gamingcirclejerk,What a twist!
Gamingcirclejerk,Upvotes to the left.
Gamingcirclejerk,Games were better in my childhood when they only featured straight white protagonists
Gamingcirclejerk,Posted Unironically in one of my Discord Servers
Gamingcirclejerk,"EA SUCKS, upvotes to the left"
Gamingcirclejerk,My fish got anal cancer
Gamingcirclejerk,They truly will gild anything.
Gamingcirclejerk,I've been working on the same game for 7 years now. I've scrapped it and started over 6 different times. This time I think I'm finally happy with what I have.
Gamingcirclejerk,My mother just fucking died
GlobalOffensive,Combined the faces of all the players to be a legend at all 14 majors.
GlobalOffensive,Silver sense (I'm the middle one)
GlobalOffensive,the most aussie thing ever
GlobalOffensive,Flusha's mom passed away
GlobalOffensive,♫ We started with 1 Nunchuk now we're here ♪
GlobalOffensive,Team Liquid vs ENCE eSports / IEM Katowice 2019 - Quarter-Final / Post-Match Discussion
GlobalOffensive,Pasha carrying the trophy to the stage
GlobalOffensive,New Cache Callouts
GlobalOffensive,I think i just got the best awp ace of my life yet
GlobalOffensive,Petition to upgrade the barrel of the desert eagle to be a circle instead of an octagon
HistoryMemes,I ask myself everyday
HistoryMemes,"Not sure if this is the right place to post, but whatever"
HistoryMemes,Quick fake China Is Asleep! Up-vote flag of REAL China.
HistoryMemes,"Semper Fi, my friends"
HistoryMemes,“Them boys do work” my history professor
HistoryMemes,When you open Snapchat in Vietnam's forest
HistoryMemes,Just one more Civil Dispute before bed
HistoryMemes,Can you blame him? Rome sounds way better
HistoryMemes,At least we fought
HistoryMemes,Either that or we’re all broke.
Jokes,R Kelly is really changing the rap game
Jokes,Why is girlfriend one word but best friend is two words?
Jokes,NSFW - A mother was walking down the hall when she heard a humming sound coming from her daughter's bedroom. When she opened the door she found her daughter naked on the bed with a vibrator.
Jokes,"My bullies broke my MP3-Player at school. Luckily, my parents bought me an MP4 for my birthday, but these idiots destroyed it again."
Jokes,What's the difference between a Syrian kindergarten and an ISIS hospital?
Jokes,"Pun enters a room, kills 10 people"
Jokes,What Asian stereo type do you hear the most?
Jokes,"Several centuries ago, the Pope decreed that all the Jews had to convert to Catholicism or leave Italy. There was a huge outcry from the Jewish community, so the Pope offered a deal. He'd have a religious debate with the leader of the Jewish community..."
Jokes,"When a girl changes her clothes in front of you, she's either really interested or you're level 99 friend-zoned"
Jokes,Wife: “I’m pregnant.”
KingdomHearts,It really do be like that sometimes
KingdomHearts,[KH3] [Media] /r/MurderedByWords
KingdomHearts,A masterpiece
KingdomHearts,[Media] I miss them so much
KingdomHearts,"For anyone who is still doubting if KH3 lived up to the hype, you can fly through space as a dog on a skateboard"
KingdomHearts,[Media] The Disney world we'd all been hoping for
KingdomHearts,hmmm
KingdomHearts,"Remember, there’s always someone suffering more."
KingdomHearts,"Like, okay, hair. But am I the only one who thought KH2 Kairi looks older than KH3 Kairi?"
KingdomHearts,Hallow Bastion tattoo !
MemeEconomy,Just look at this format! What a catch!
MemeEconomy,Spongebob memes are always a safe investment!
MemeEconomy,This has massive potential
MemeEconomy,OC Template - Truck driving into frame green screen (Video in comments)
MemeEconomy,"Another Indiana Jones format, probably won’t do well in the long-term - INVEST!"
MemeEconomy,Brand new normie proof green screen template to invest in! (OC)
MemeEconomy,Perfectly describes whats happening right now! Invest into boycotting NFL
MemeEconomy,Just add three things template. Couldn’t be simpler. Invest now!
MemeEconomy,Multifunctional and fresh! Stratton Oakmont CEO Approved. INVEST FAST!
MemeEconomy,Invest in the seeing eye to eye format
Memes_Of_The_Dank,Like what is a Super Bowl
Memes_Of_The_Dank,Admit it
Memes_Of_The_Dank,Only subreddit I post on
Memes_Of_The_Dank,Improvise. Adapt. Overcome
Memes_Of_The_Dank,Smfh peta
Memes_Of_The_Dank,Hi Mark
Memes_Of_The_Dank,facts
Memes_Of_The_Dank,All y'all smell like bitch to me.
Memes_Of_The_Dank,I'll buy 10
Memes_Of_The_Dank,Finally
Minecraft,So I downloaded the wrong shaderpack...
Minecraft,This is my hole
Minecraft,Not to flex on you guys but...
Minecraft,Making a reflective floor by mirroring and copying the entire room underneath the floor.
Minecraft,Custom Waterfall Biome (I spent waaaaay too long trying to make it look naturally generated).
Minecraft,a project I've been working on :D
Minecraft,hmmm
Minecraft,Had to get my heart out of my stomach after this.
Minecraft,I made a 100% automatic concrete making machine on our vanilla server
Minecraft,illegal
MurderedByWords,Boomer murdered for shitty take (resubmitted with censoring)
MurderedByWords,Enough said.
MurderedByWords,Trust us...
MurderedByWords,Paul Ryan gets destroyed
MurderedByWords,This lady is a badass
MurderedByWords,Don Jr should just become the side bar for this sub
MurderedByWords,Guy kills all four Bachelors with 0 bullets
MurderedByWords,Some fire served from the underworld
MurderedByWords,Taken from r/sadcringe but fits here perfectly
MurderedByWords,Purple heart war vet or orange ass hole?
NoStupidQuestions,Why do people wear shoes in the house?
NoStupidQuestions,Why is it so awkward to meet your cat in the wild?
NoStupidQuestions,"Matched with girl on tinder. Profile said 18, got phone number, she calls and reveals she’s 10."
NoStupidQuestions,"Is the word ""fuck"" in ""fuck bitches, get money"" supposed to mean ""ignore"" or ""have sex with""?"
NoStupidQuestions,Why is sleep deprivation normalized in college/university?
NoStupidQuestions,Does the hitler family line still exist?
NoStupidQuestions,"What would happen if I squished an entire loaf of bread in a vice and ate the ensuing ""slice"" in a couple of bites?"
NoStupidQuestions,"If you walked outside bare-assed on a cold day, could you ""see"" your farts like you see your breath?"
NoStupidQuestions,"Do all adults feel they are ""playing"" being an adult?"
NoStupidQuestions,Does anyone else get filled with so much dread about going back to work/school on Monday that it essentially ruins their Sunday evenings?
OldSchoolCool,The Great North Dakota Blizzard of 1966
OldSchoolCool,"Franceska Mann, arrived at Auschwitz in 1943, when ordered to strip, she did so provocatively, distracting the guards. She grabbed the roll call officers gun and shot him dead, then wounded one more before other prisoners joined her rebellion, before all being shot dead, 1940's"
OldSchoolCool,Nobody believed them! (Circa 1963)
OldSchoolCool,"My old man in Vietnam, 1970’s"
OldSchoolCool,My parents recreated their honeymoon picture 40 years later.
OldSchoolCool,This 1973 photo of Marvin Gaye looks like it could have been taken yesterday (pic by Jim Britt)
OldSchoolCool,"My grandmother and great grandmother late 1920s China. Since she was the only child, they kept her hair short like a boy so that she would be respected as the future head of the household. She also told me she refused to take this picture until they bribed her with grapes."
OldSchoolCool,"Slash before he grew out his hair, playing with his band Tidus Sloan at Fairfax High School, 1982."
OldSchoolCool,I wasn’t the pink ranger. I wasn’t a princess. No. I was Sonic the Hedgehog. 1994.
OldSchoolCool,"japanese archers, 1860s (colorized)"
Overwatch,"My thoughts on the new reaper update, put into poetry"
Overwatch,I’m fairly new to the game. So this made near crap my pants.
Overwatch,Living in an instant death zone in Hanamura with Immortality Field
Overwatch,Always dreamed of this day - day i would deflect Hanzo's Dragons.
Overwatch,"Timing concept for Orisa's shield, please give your feedback!"
Overwatch,Baptiste Origin Story
Overwatch,Devs understanding this is the only part of the League skins that people are gonna look at
Overwatch,"Can we get a ""night"" version of the League menu, please?"
Overwatch,Sombra can uncloak silently by emoting
Overwatch,When no one on your team can kill the snipers
PewdiepieSubmissions,Pewds livestream of fortnite has 100k more live viewers than all of fortnite on Twitch rn making him the biggest fortnite streamer
PewdiepieSubmissions,Pewdiepants
PewdiepieSubmissions,ELON MUSK MEME REVIEW
PewdiepieSubmissions,I drew pewdiepie for 24 hours straight.. I did what I could to help... small youtuber: ZHC
PewdiepieSubmissions,Youtube did an oopsie
PewdiepieSubmissions,Yaaah!
PewdiepieSubmissions,Ahh that's hot
PewdiepieSubmissions,Youtube’s copyright problem
PewdiepieSubmissions,A Tale to tell the Generations
PewdiepieSubmissions,Let's help this guy out with his project!!!!
PoliticalHumor,I’ll just put this here.
PoliticalHumor,Super Bowl joKe
PoliticalHumor,A GOP fraud getting ratted out by his family. I love a good foreshadowing.
PoliticalHumor,"Fox News ""exposing"" AOC"
PoliticalHumor,No better day than today to start
PoliticalHumor,Speaks Volumes About The Red Hats
PoliticalHumor,Republicans should stop trying to troll Ocasio-Cortez...
PoliticalHumor,Rising tides aren't trickling down
PoliticalHumor,God no anything but that.
PoliticalHumor,REPUBLICAN LOGIC
PrequelMemes,General Kenobi
PrequelMemes,When is the hd remaster?
PrequelMemes,I've stole it but you should see it
PrequelMemes,"A suprise to be sure, but a welcome one"
PrequelMemes,It’s perfectly legal
PrequelMemes,I met the great Hello There himself
PrequelMemes,When you hear that the Dallas Stars actually played Sweet Victory at halftime
PrequelMemes,*Visible Happiness*
PrequelMemes,Credits will do fine
PrequelMemes,Rogue One (2016)
Rainbow6,The wall outlets on Outback aren't the Australian outlets
Rainbow6,Saw Blackbeard on the news today
Rainbow6,My cat had the wrong idea
Rainbow6,Sick
Rainbow6,Happens every time
Rainbow6,There's a funny little animation on the Burnt Horizon main menu background if you wait long enough!
Rainbow6,What an exciting news
Rainbow6,Blitz is meta | Credit: Instagram user: @rooks.plates
Rainbow6,Crouch spamming... What do you think about it?
Rainbow6,Pokemon Six-Rainbow Edition
ShitPostCrusaders,jotaro playing with the gang
ShitPostCrusaders,Those little shits
ShitPostCrusaders,Meme monday at my school
ShitPostCrusaders,Here is another one
ShitPostCrusaders,Today is the only day you can upvote this
ShitPostCrusaders,DIO goes shopping for garden decorations
ShitPostCrusaders,Netflix Adaptation
ShitPostCrusaders,Jonathan! Why cant you be more like DIO?
ShitPostCrusaders,Which character is in the most parts?
ShitPostCrusaders,Priorities
Showerthoughts,Whoever created the tradition of not seeing the bride in the wedding dress beforehand saved countless husbands everywhere from hours of dress shopping and will forever be a hero to all men.
Showerthoughts,It would be cool if after you died you could see the top 5 times you almost died.
Showerthoughts,"The syllables in “on your mark, get set, go” are a countdown"
Showerthoughts,"Both sexes can fuck a Pringles can, but neither can do it well."
Showerthoughts,Running from the cops is the ultimate double or nothing.
Showerthoughts,Monopoly would be more realistic if the person with the most money got to change the rules whenever they liked
Showerthoughts,"If everyone on earth died simultaneously, the internet would be comprised entirely of bots posting, liking, and upvoting each other."
Showerthoughts,Posting newborn’s weight and length makes childbirth rather too similar to fishing
Showerthoughts,Inside every 85 year old man is an 18 year old saying what the fuck just happened.
Showerthoughts,"All languages travel at the speed of sound, sign language travels at the speed of light."
Sneakers,"My best friend passed away this week. Heartbroken, but wanted to share this. His joyful spirit, open heart, and love for sneakers. Miss you always B."
Sneakers,Flex Rogers
Sneakers,I made my butters a little bit more interesting. Let me know what you think!
Sneakers,Happy Valentines Day /r/Sneakers
Sneakers,This dude living in the year 3000
Sneakers,Shoutout to stockx for sending me a shoe which isn’t even remotely close to what I ordered. Never buying from there again
Sneakers,This is America.
Sneakers,When no one has commented on my sneakers all day
Sneakers,Family flex
Sneakers,"Girlfriend of 3 years broke up with me last week. Spent the Valentines Day money I was going to spend on her on me instead "
The_Donald,I WAS DYING
The_Donald,COVINGTON STUDENT SUES WASHINGTON POST FOR 250M
The_Donald,Democrats Continue To Be Shocked By Obvious Things They Vote For
The_Donald,Jussie Smollett has been indicted by a grand jury
